{
  "id": "ev-il-threshold",
  "claim": "A party list needs 3.25% of total valid votes to win Knesset seats.",
  "label": "established_fact",
  "countries": [
    "israel"
  ],
  "topics": [
    "election"
  ],
  "event_date": null,
  "confidence": "high",
  "recorded_at": "2026-10-18T12:00:00+00:00",
  "sources": [
    {
      "url": "https://blogs.loc.gov/law/2026/10/falqs-israels-upcoming-election-on-october-27-2026/",
      "publisher": "Library of Congress, In Custodia Legis",
      "published_at": "2026-10-09",
      "accessed_at": "2026-10-18",
      "kind": "official"
    }
  ]
}
