{
  "id": "ev-il-haredi-draft-crisis",
  "claim": "From May 2026, efforts to dissolve the Knesset gained momentum amid recurring coalition crises over Haredi military conscription.",
  "label": "observed_behavior",
  "countries": [
    "israel"
  ],
  "topics": [
    "coalition"
  ],
  "event_date": null,
  "confidence": "medium",
  "recorded_at": "2026-10-18T12:00:00+00:00",
  "sources": [
    {
      "url": "https://en.wikipedia.org/wiki/2026_Israeli_legislative_election",
      "publisher": "Wikipedia",
      "published_at": null,
      "accessed_at": "2026-10-18",
      "kind": "reference"
    }
  ]
}
